index,song,year,artist,genre,lyrics
0,b-day,2009,jesus Lopez,Pop,"Happy birthday to you, baby"
1,back-to-back,2009,drake,Pop,"I won the grammy, back to back"
2,bohemian-rapsody,2009,Queen,Rock,"Is this the real life? Or is this just fantasy"
3,don't stop me now,2009,Queen,Rock,"Don't stop me now, dont me now. Im having a good time, having a good time"
4,PTSD,2009,G-Herbo,Rap,"I got a war-zone in my head, dont stand too close to me. I got PTSD"
5,Thank you next,2009,Ariana Grande,Pop,"I was in love with Pete, now I just sing songs. I need attention. I want attention. I need love"
6,Mia,2009,Bad Bunny,Pop-Latino,"Bebe tu eres mia. Yo te amo mi amor. I love you"
